{
    "$schema": "https://cubica.platform/schemas/design-artifact.v1.json",
    "id": "top-sidebar-6-cards",
    "type": "mockup",
    "name": "6 карточек с верхним сайдбаром",
    "description": "Экран с сеткой из 6 карточек выборов и верхним сайдбаром ресурсов/метрик",
    "image": {
        "path": "mockups/top-sidebar-6-cards.jpg",
        "format": "jpg",
        "dimensions": {
            "width": 1920,
            "height": 1080
        },
        "dpi": 72
    },
    "generation": {
        "prompt": "Game UI screen split into two sections: a horizontal top sidebar with resource metrics and a main content area below with a grid of 6 interacting cards. Art style is flat vector illustration, clean lines, cool color palette.",
        "negative_prompt": "realistic, 3d, cluttered, noise, warm colors",
        "style_reference": "concepts/main-style",
        "model": "midjourney-v6"
    },
    "regions": [
        {
            "id": "topbar",
            "bounds": {
                "x": 0,
                "y": 0,
                "width": 1920,
                "height": 120
            },
            "type": "container",
            "description": "Верхняя панель с метриками и статусом",
            "layout": {
                "type": "flex",
                "direction": "row",
                "padding": 20,
                "gap": 30,
                "align": "center"
            },
            "generation": {
                "prompt": "Deep blue horizontal top bar background with vector ice/snow decorations"
            },
            "style": {
                "background": "#0f4c75"
            },
            "elements": [
                {
                    "id": "day-counter",
                    "type": "indicator",
                    "description": "Счетчик оставшихся дней",
                    "label": "45 Осталось дней",
                    "generation": {
                        "prompt": "Icon of a yellow sun on a light blue background plate, text '45 Осталось дней'"
                    }
                },
                {
                    "id": "metrics-list",
                    "type": "list",
                    "description": "Горизонтальный список игровых метрик",
                    "layout": {
                        "type": "flex",
                        "direction": "row",
                        "gap": 15
                    },
                    "generation": {
                        "prompt": "Horizontal list of metric items with ice shard backgrounds"
                    },
                    "elements": [
                        {
                            "id": "metric-knowledge",
                            "label": "-1 знания",
                            "type": "stat-item",
                            "generation": {
                                "prompt": "Blue ice shard background plate"
                            }
                        },
                        {
                            "id": "metric-trust",
                            "label": "15 доверие",
                            "type": "stat-item",
                            "generation": {
                                "prompt": "Blue ice shard background plate"
                            }
                        },
                        {
                            "id": "metric-energy",
                            "label": "7 энергия",
                            "type": "stat-item",
                            "generation": {
                                "prompt": "Blue ice shard background plate"
                            }
                        },
                        {
                            "id": "metric-control",
                            "label": "-8 контроль",
                            "type": "stat-item",
                            "generation": {
                                "prompt": "Blue ice shard background plate"
                            }
                        },
                        {
                            "id": "metric-status",
                            "label": "-5 статус",
                            "type": "stat-item",
                            "generation": {
                                "prompt": "Blue ice shard background plate"
                            }
                        },
                        {
                            "id": "metric-contact",
                            "label": "10 контакт",
                            "type": "stat-item",
                            "generation": {
                                "prompt": "Blue ice shard background plate"
                            }
                        },
                        {
                            "id": "metric-constructive",
                            "label": "8 конструктив",
                            "type": "stat-item",
                            "generation": {
                                "prompt": "Blue ice shard background plate"
                            }
                        }
                    ]
                }
            ]
        },
        {
            "id": "main-content",
            "bounds": {
                "x": 0,
                "y": 120,
                "width": 1920,
                "height": 960
            },
            "type": "container",
            "description": "Основная область контента с сеткой карточек",
            "layout": {
                "type": "grid",
                "columns": 3,
                "gap": 20
            },
            "style": {
                "background": "#1b262c"
            },
            "generation": {
                "prompt": "Dark blue main content area with a grid of 6 cards"
            },
            "elements": [
                {
                    "id": "cards-grid",
                    "type": "grid",
                    "description": "Сетка из 6 карточек",
                    "generation": {
                        "prompt": "Grid layout of 6 identical card placeholders"
                    },
                    "elements": [
                        {
                            "id": "card-1",
                            "type": "card",
                            "description": "Карточка 1",
                            "generation": {
                                "prompt": "Game card with illustration"
                            }
                        },
                        {
                            "id": "card-2",
                            "type": "card",
                            "description": "Карточка 2",
                            "generation": {
                                "prompt": "Game card with illustration"
                            }
                        },
                        {
                            "id": "card-3",
                            "type": "card",
                            "description": "Карточка 3",
                            "generation": {
                                "prompt": "Game card with illustration"
                            }
                        },
                        {
                            "id": "card-4",
                            "type": "card",
                            "description": "Карточка 4",
                            "generation": {
                                "prompt": "Game card with illustration"
                            }
                        },
                        {
                            "id": "card-5",
                            "type": "card",
                            "description": "Карточка 5",
                            "generation": {
                                "prompt": "Game card with illustration"
                            }
                        },
                        {
                            "id": "card-6",
                            "type": "card",
                            "description": "Карточка 6",
                            "generation": {
                                "prompt": "Game card with illustration"
                            }
                        }
                    ]
                }
            ]
        }
    ],
    "style_tokens": {
        "colors": {
            "sidebar_bg": "#0f4c75",
            "main_bg": "#1b262c",
            "text_primary": "#ffffff",
            "text_secondary": "#bbe1fa",
            "accent_ice": "#a8d8ea"
        },
        "typography": {
            "font_family": "Sans-Serif",
            "heading_style": "bold uppercase",
            "body_style": "regular"
        }
    },
    "meta": {
        "author": "Antigravity Agent",
        "created_at": "2026-01-18T22:35:00+03:00",
        "version": "1.0",
        "tags": [
            "mockup",
            "topbar",
            "cards-grid",
            "antarctica"
        ],
        "notes": "Created based on top-sidebar-6-cards.jpg"
    }
}